uid,title,the content,writer,Published at,score,comments_quantity40997476,,"&gt; computers are a very important form of technology. Without it no websites, no Roblox studio, and no nothin.<p>Don&#x27;t you love the way children see things? So cute.",brabel,1721321529,,
40997999,,"I love this so much! Great work, Naya!<p>Incidentally, I was creating an image for a slide for a talk a few weeks ago, showing off HTML circa 1996 and decided to do it in Windows 95 (which is what I used to write my first web pages when I was 12) and it was a lot harder than I thought it would be (mostly because the intricacies of what HTML versions were supported in the included browser versions of the Electron emulator I was using), to recall what tags did and didn&#x27;t work.<p>But I credit HTML with everything for me, as far as computer programming is concerned. Having a way to express markup in a text editor and see the results on a web page was life-changing.<p>Love to see first graders doing this now!",filmgirlcw,1721324453,,
40996472,,"I suggest you back up the HTML files as a record of her work when she was still a child, it will be a family treasure in the future :) You can even add it under your family&#x27;s domain for safekeeping.",marvstazar,1721316366,,
40997376,,"When I started using the web, this is what all pages looked like and tons and tons of people had personal ones just like this. It was so great. I used to love touring all the self expression.<p>Not quite the first, but this is how mine looked in &#x27;98: <a href=""https:&#x2F;&#x2F;web.archive.org&#x2F;web&#x2F;19981205195643&#x2F;http:&#x2F;&#x2F;www.justkidding.com&#x2F;"" rel=""nofollow"">https:&#x2F;&#x2F;web.archive.org&#x2F;web&#x2F;19981205195643&#x2F;http:&#x2F;&#x2F;www.justki...</a>",tqwhite,1721320893,,
40996704,,"I love this. Her little site really takes me back to the age of the internet I often miss.<p>Back in the 90s, fresh out of art school I knew I needed to create a portfolio website of some sort. I went to a Borders Books and got a book about 4 or 5 inches think about HTML and how to craft a site using a tool built into Netscape Navigator. Over the course of a week or so I created a site very similar in function to the one in the OP. The main difference was the content.<p>On my homepage I featured one of my drawings - a color pencil rendering of a very large&#x2F;wide man in a jock strap looking at the viewer with a cunning smile. Yes, I was very mature. You had click on his belly to enter the site. This was where I learned to make an image map for the first time. When you clicked it he said, &quot;Ooh, that tickles&quot; and then you were in where the portfolio and navigation was presented.<p>It was all HTML 4, no javascript, no cookies or forms - all very basic stuff.<p>And that site got me my first real job in the design world (at an Adobe competitor called Micrografx, which later imploded). The rest is history! Thanks, Netscape.",erickhill,1721317264,,
40998053,,&gt; Tablets aren&#x27;t very useful. Well to do stuff Computers can anyway.<p>Naya gets it!,karaterobot,1721324773,,
40996099,,"I was talking to my parents the other day and surprised myself getting pretty chocked up remembering how my dad had shown me how to program an ascii animation on his 386, and how the wonder I felt at that in many ways led me to where I am today, so many years later. These things matter.",nimbleal,1721314207,,
40995806,,"It&#x27;s a very good website. Fast, simple UX, no JavaScript and focused on content.",computerfriend,1721312400,,
40997972,,"That&#x27;s cool. I remember myself around that age. Before I learned about HTML, I used to draw web sites in MS Paint. And these both activities were so much fun.",Pavilion2095,1721324322,,
40997428,,"Excellent website! Thanks for sharing, I learned something: the scientific name of a cheetah.<p>Tell your daughter to keep making things that she likes to make!",err4nt,1721321260,,
40997912,,"I like it. This fondly, yet somewhat bitterly, recalls memories of my 25-year-old self creating his first HTML page in 1995, or even my 10-year-old self writing his first BASIC program in 1980.",fermigier,1721323882,,
40993563,,Very cute!<p>I did something similar  with my dad when I was a kid. First basic HTML then Dreamweaver.<p>A couple years down the road and I’m working at a SaaS company.<p>Beware.,crngefest,1721290714,,
40995731,,"I got started with Netscape Composer around this age, as you could easily switch between the HTML view and the WYSIWYG view and see what everything does. Seamonkey is a still maintained version of the old Netscape&#x2F;Mozilla suite which has Composer.<p><a href=""https:&#x2F;&#x2F;www.seamonkey-project.org&#x2F;"" rel=""nofollow"">https:&#x2F;&#x2F;www.seamonkey-project.org&#x2F;</a>",gtk40,1721311812,,
40995878,,"HTML is such a great abstraction and syntax. I wonder if the same 7 year old would be able to (or have the attention) to learn something like React? Probably not.<p>Maybe we should be testing our interfaces and API&#x27;s with 7 year olds from now on. If they can&#x27;t or won&#x27;t use it, its probably a good signal the design is wrong.",iamleppert,1721312867,,
40997989,,Q: When&#x27;s the best time to take your kids to dinner?<p>A: When the graduate from medical school!<p>—Dave Barry,_wire_,1721324404,,
40997367,,I showed my kid (also around that age) how you could have fun with PRINT statements in C64 BASIC. He really enjoyed it and just the idea alone that you could control the computer instead of it being a black box.<p>Perhaps a website could be fun too. But HTML 3.2 was much more friendly to beginners than everything that is out there now.,dep_b,1721320852,,
40997402,,"&quot;computers are a very important form of technology. Without it no websites, no Roblox studio, and no nothin.&quot;<p>Amen!",l72,1721321034,,
40996774,,&gt; Did you know that a dog puts its tail between its legs when it&#x27;s sad.<p>Can you spot the mistake?<p>Neither can I. :-)<p>Well done.,tutipop,1721317511,,
40994107,,"Great job Naya :)<p>For other parents here, if your kids are interested in learning HTML and CSS with the help of cute aliens, my son (who was 11 at the time) and I built HTML Planet for Kids [0]. The course uses a visual editor for manipulating HTML, so that there is less typing and frustrating syntax mistakes, while still exposing the code directly without any added abstractions.<p>[0] <a href=""https:&#x2F;&#x2F;htmlplanetforkids.com&#x2F;"" rel=""nofollow"">https:&#x2F;&#x2F;htmlplanetforkids.com&#x2F;</a>",mattront,1721297197,,
40995837,,"Wonder why for such a cute and clean website, uMatrix is showing cloudlflareinsights.com blocked? On the off chance that a 7 year old isn&#x27;t interested in website traffic analytics, is it Cloudflare injecting their shit?",noisy_boy,1721312626,,
40996242,,"You better believe I went straight for the cheetah page. No, I didn’t know they’re about 59 inches long! I learned something new today!",kstrauser,1721315043,,
40997619,,"I love, how the path for the computer page is &quot;&#x2F;unicorncopy&quot;. Already thinks like a real pro!",taulien,1721322289,,
40995134,,This is adorable and made me feel good! I learned something about cats too. Thank you for sharing.,lnauta,1721307329,,
40997973,,"If she has those concepts about html, she will learn more about html and then css very quickly with the help of AI.",dxxvi,1721324333,,
40993658,,"She really nailed page load speed and to a large degree UX (links are clearly links, navigation just works).<p>Many large companies have wasted lots of money on performance and UX while still being worse than this!",eitland,1721291951,,
40996593,,&quot;Cats are about 2 feet that means six times there height would be about 12 feet.&quot;<p>hehehehehe,AzzyHN,1721316862,,
40997242,,"I often hear about the simplicity form factors of the internet in a bygone era, before my time, in the mid to late 90&#x27;s. Now, from all the stories I&#x27;ve heard and the visuals I&#x27;ve seen, someone that&#x27;s a third of my age now seems to be delivering that spirit of simplicity back :)",HaZeust,1721320109,,
40996520,,I learned quite a lot by viewing the source of this delightfully clean and spartan website.<p>You don&#x27;t need a DOCTYPE tag?<p>You don&#x27;t need a head tag?<p>You don&#x27;t need to declare the charset?<p>The body tag has a &quot;background&quot; attribute?<p>The HTML &quot;center&quot; tag still works?,troymc,1721316584,,
40998033,,:3 so cute it made my day a bit happier thanks for posting,dev1ycan,1721324656,,
40996030,,"Ok but did you make sure she used Kubernetes to deploy? :)
Seriously her web page made me smile.  Well done!",rossdavidh,1721313774,,
40993808,,&gt; Without computers used have to use tablets. Tablets aren&#x27;t very useful.<p>That&#x27;s the spirit!,benterix,1721293524,,
40997381,,"Wow, this is so cool! Your website is clear and easy to read. It&#x27;s super easy to find everything, and it works really fast too. Awesome job, keep it up!",M4R5H4LL,1721320912,,
40997319,,This is the best thing I&#x27;ve seen on the internet in a long time. I&#x27;m going to bookmark it and check back for more informative content.<p>I hope you tell Naya how much HN is loving it!,apeace,1721320540,,
40995886,,"Seriously, thank you so much for sharing this!  It brought a much needed smile to my face this morning.<p>Please tell your daughter that Ben really liked it and his favorite page was the dogs page.  Question for her:  Is that a picture of your dog?  Does the dog have a name?",freedomben,1721312896,,
40997355,,"Lovely! My first website was when I was 9 years old, and I used Netscape Composer to create it. My content was also centered in the screen :)",henvic,1721320791,,
40995738,,"I think I was 8 or 9 when I started building my first website as well, and it looked remarkably similar to this. :) I think the only difference really is that all guides used uppercase for html tags back then. Happy that went out of style.",herrkanin,1721311843,,
40994351,,"Cool! I made my first HTML website in 2001, when I was 10. The ISP allowed you FTP some HTML and image files into a folder, and you got a little website.<p>Figuring out HTML was not too hard for me as a kid. Things enclosing other things is not a hard to grasp concept. I didn&#x27;t use CSS and back then you had &lt;center&gt; and stuff; nowadays it&#x27;s frowned upon as mixing up semantics and presentation, but back then it made sense to me.<p>But doing any sort of programming (like at least writing batch files that had ifs and loops) was way harder and it took me several years to figure out.",cue_the_strings,1721299791,,
40997412,,"No pop ups
No cookies
Loads quickly.
Only thing is the cloudflare pages analytics js.
Frontend masterpiece lol",andrewfurey2003,1721321119,,
40995456,,"Great job, and I didn&#x27;t know cats had such a wide field of vision they could see behind them!",revjx,1721309748,,
40993573,,&quot;Did you know that a cat can fall from a 32 story building and survive!&quot;<p>I love how this ends on an exclamation mark and not a question mark. Obvious in hindsight.,jstummbillig,1721290880,,
40997107,,"That&#x27;s awesome!<p>I love that such a simple page taught her how to make a completely functional website. Links, images, styling, and even an external script inclusion.<p>Way to go Naya.",ryanisnan,1721319232,,
40997562,,I notice it did not go down despite the HN hug of death !,nkg,1721321999,,
40997350,,"&gt; no roblox studio, no nothin",explosion-s,1721320724,,
40993627,,"This looks like a solid first step. I am also teaching my 8yo a bit of coding, starting with HTML but he complains about a lot of typing, he is slow in typing so it becomes painful for him.<p>Did your daughter face this problem?",sachinjain,1721291557,,
40995712,,"Great job!<p>I was significantly older when I built my first website (19, in 1996) but I&#x27;m so glad I had a space to pretty easily put up basic HTML (Geocities, though there were similar options). No WYSIWYG, no build steps, just the basic text-only HTML which created a foundation to build on. It&#x27;s unfortunate there aren&#x27;t really good options for that for today&#x27;s younger creators. (is there?)",bdcravens,1721311663,,
40995766,,"Way to go, Naya! You taught me something new about cats, and I&#x27;m probably older than your dad!<p>Keep it up, you&#x27;re doing great! :)",spdustin,1721312144,,
40997009,,This really takes me back to high school when everyone was writing websites like this... it was such a fun and pure time.<p>Well done Naya!,sibartlett,1721318639,,
40993843,,&gt;Tablets aren&#x27;t very useful. Well to do stuff Computers can anyway.,numerative,1721294031,,
40993735,,"&gt; computers are a very important form of technology. Without it no websites, no Roblox studio, and no nothin.<p>Oh yes indeed.",icoder,1721292659,,
40993862,,"Tell her she chose a fantastic background image :) Also cheetahs are beautiful felines and instead of roaring, they chirp like birds<p><a href=""https:&#x2F;&#x2F;www.youtube.com&#x2F;watch?v=E6Qh3VTmtxU"" rel=""nofollow"">https:&#x2F;&#x2F;www.youtube.com&#x2F;watch?v=E6Qh3VTmtxU</a>",sph,1721294224,,
40996075,,"Wow, that computer page comes with a serious color shock, but I guess kids like squeaky saturated colors :D<p>Having fun is the most important thing, everything else follows that.",tempodox,1721314060,,
40993580,,"Love it! Well done Naya, the information on the page is excellent!<p>By any chance was this made on a tablet? I see it mentions “tablet… make a website”. Perhaps if children grow up having accessing to tablets over computers, making websites on them won’t seem as foreign compared to a computer.",sunnybeetroot,1721291029,,
40993747,,"She centered the page like a pro.
Also, It gave me nostalgia watching how fast the page loads.",Michvalwin,1721292786,,
40997152,,"Aww, &lt;3 I love this. Keep up the great work, naya!!",madcow2011,1721319579,,
40996783,,"No darkmode, literally unusable",callamdelaney,1721317549,,
40997694,,This is the way.,jprd,1721322707,,
40997187,,Pretty darn good - looking forward to updates!,redleggedfrog,1721319798,,
40996129,,cats uri: &#x2F;unicorn !,tagami,1721314352,,
40997136,,"200+ comments about a 7 years old website = :-)<p>Great job, Naya.",lazlee,1721319415,,
40994154,,"Awesome! I love seeing kids play around with code. Curiosity is very important at any age.<p>That’s how I started too. Back in the days of Internet Explorer, I used to click View -&gt; Source and mess around with the HTML in Notepad. I’d change the content, blocks, colors...<p>About 25 years later, I’m still coding, but right now I’m deploying the data transformation pipeline (T in the ELT) on production server to calculate business KPIs.",otar,1721297741,,
40995293,,"Good for the kid getting her hands dirty! I was learning C by the time I was 9, but if HTML and the public Internet had been around when I was that age, I may have went that way instead!",aldousd666,1721308674,,
40994933,,"I was 7 years old when I made my first website too.<p>Back then, i remember my dad was having trouble using Dreamweaver. I went to try and help him, and found that using Dreamweaver was more fun to me than playing with my XBOX or PS1",tremarley,1721305448,,
40997664,,I love the Geocities-era Web 1.0 energy this has. Your daughter is avery creative person.,bitwize,1721322526,,
40996097,,"It works! More than can be said for many things I have made. Congrats, Naya!",pnemonic,1721314187,,
40994310,,"Awesome!<p>That&#x27;s pretty much how I make websites up to this day.<p>Later, if it grows, I usually add a stylesheet file to separate content and layout.<p>Then I sometimes add some JavaScript.<p>Then I sometimes add some backend storage and processing.<p>Then I need a certificate for https.<p>Then if it gets a lot of traffic, I put a CDN in front of it.<p>And that&#x27;s it.",mg,1721299426,,
40994556,,"Oh my god I did almost the same thing when I was 9, I think I lost the website though. I took excerpts from an encyclopedia on animals and made small blog style pages very similar to this . It was so fun!",tintedfireglass,1721301843,,
40997570,,"I enjoyed the website.<p>It just needed a marquee, blink, visit counter, guestbook, under construction disclaimer, some pixelated 256 color palette animated gif, and you would become one of us.",29athrowaway,1721322040,,
40993605,,Very nice! And I actually learned something about cats. Never knew they can see a little bit behind them ;-),nicholasbraker,1721291251,,
40993624,,Wow. This is so much better than what I created as my first website in 1997 when I was 19 years old.<p>I am deeply impressed.,sdoering,1721291537,,
40996725,,Bookmarked and going in the webring,xxr,1721317322,,
40993582,,"&gt; A dog that my aunt has uses a button to tell her if she&#x27;s hungry or tired.<p>I‘m intrigued! We also have two dogs and the more I know them, the more I‘m fascinated by their ability to tell us exactly what they feel. I didn’t know they can learn to use buttons to do this.",dgb23,1721291039,,
40996660,,This makes me so happy to see.,tiffanyh,1721317134,,
40993649,,"Great work! Back in the day (when I was about 9 years old) I did something similar but for my poetry and dinosaur related interests, and that kicked off my still ongoing multi-decade journey in web development.<p>Ah the good old days :&#x27;)",omneity,1721291827,,
40994246,,"Reminds me of my first website, back in 1994&#x2F;95. I used yellow text on bright blue backgroud and wrote about music I liked. Only I was 10 years older.",kaffeeringe,1721298776,,
40993662,,I love this domain name so much. &lt;3 Great job to your daughter.,RobertJaTomsons,1721292001,,
40995063,,The cat page is my favorite,dannypovolotski,1721306745,,
40993675,,"This is great, it looks nice, works exactly as one would expect it to (very links, no clickbait), cats (the internet was made for cats after all) and loads instantly.",isatty,1721292128,,
40995373,,"Great website, and very informative! Hope she keeps it up!",vegancap,1721309223,,
40997262,,Cute!,zoklet-enjoyer,1721320217,,
40993601,,Love it! The background is awesome! The 90s &#x2F; early 2000s vibes this gives! Looks straight out of geocities and I love it. Great work Naya!,saghul,1721291218,,
40993838,,"This is so cool. The site loads fast, is responsive and will work on all browsers.<p>My very first website on Geocities looked pretty much like this.<p>Joy of creation.<p>Good job.",yashg,1721293981,,
40995226,,there aren&#x27;t many tasks adults can do that cannot be taught to children. what are examples of ones that can&#x27;t?,motohagiography,1721308031,,
40994995,,"&gt; computers are a very important form of technology. Without it no websites, no Roblox studio, and no nothin. Without computers used have to use tablets. Tablets aren&#x27;t very useful. Well to do stuff Computers can anyway.<p>Come on, Apple. A seven year-old gets it, why can&#x27;t you? Let iPads run MacOS.",jmull,1721306069,,
40993771,,Fantastic! Only comment I could possibly have is that the cats page needs more pics of cats.,duiker101,1721292989,,
40993734,,"Not very different than what I did when I started, with XHTML et al. 
She did a great job.",andreime,1721292641,,
40993947,,Let her play like other kids.,fx1994,1721295460,,
40996734,,[big smile],CodeWriter23,1721317363,,
40996839,,Kids should be outside playing with other kids.,carabiner,1721317791,,
40993698,,Love the 90s look. Well done!,TonyTrapp,1721292324,,
40993993,,Fantastic! Are you going to teach her JavaScript as well ?,Maksadbek,1721296034,,
40994956,,This is really cool! Well done!,nunez,1721305659,,
40996436,,"I wish I still had my websites from when I was around 9 or 10. Alas they were stored on a Seagate Quantum Bigfoot (a 5.25&quot; hard disk which we our family PC had for some reason), and it failed at some point.",globular-toast,1721316169,,
40994054,,This is absolutely adorable :) Well done Naya!,Gnarl,1721296556,,
40993638,,I wish all websites looked like this again. Great job!,puttycat,1721291658,,
40995526,,"Anyone else wanting to see the original content of &#x2F;unicorn? Cats are great and all, but we want unicorns!!<p>&lt;3 wonderful project. Brings back memories of excitedly writing HTML in my drawing notebook and daydreaming what the pages would look like",hamiltont,1721310264,,
40993710,,More correct html than a senior react dev.,sleepyhead,1721292428,,
40995851,,This looks like the pages I made when I was 14-ish (45yo here) on a modem.,coding123,1721312711,,
40993583,,she&#x27;s done an amazing job! More motivation to teach my 6.5 year old something about HTML,sandman83,1721291040,,
40995395,,"This looks like my first website that I made for the game Freelancer around 2003, which was essentially just a short description of the game and a bunch of screenshots I made during gameplay.<p>It&#x27;s nice that kids these days don&#x27;t skip the basics.<p>Please, please, don&#x27;t ever tell her about Javascript.",antisthenes,1721309335,,
40993768,,"This is actually better than 90% of websites today: loads fast, no nav bars, no position: sticky, no cookie popups, no ads. The content is informative and straight to the point. A website worthy to be the inverse of the much ignored related guideline:<p>&gt;Please don&#x27;t complain about tangential annoyances—e.g. article or website formats, name collisions, or back-button breakage. They&#x27;re too common to be interesting.",Vt71fcAqt7,1721292963,,
40996315,,does she feel like dropping a frontend framework soon? modern webdev needs that sort of simplicity and focus on content.,otts_boris,1721315548,,
40993897,,"Recently I see more and more articles and social media posts surprised about the current youth’s lack of a mental model how computers actually work. I assume this is due to smartphones and tablets not letting them experiment. Laptop hardware is also usually not made to tinker with.<p>OP, I think you’re doing your daughter a great service with building an attitude that computers are just machines that can be learned about and understood. I started with HTML at 10 years old, and it gave me a lasting passion about the internet and connecting the world, leading to peace among distant people. Nowadays as an adult I’m unfortunately disillusioned due to negative aspects of social media, dating apps, and fake news, but alas..<p>Maybe in the future you can show her light javascript, the WAMP stack to make a guestbook (beware of spam nowadays), a cat image gallery with upload function (and a password). The latter features requiring something like PHP or perhaps python nowadays, and some database (I used mysql 25 years ago, perhaps sqlite or postgres nowadays?)",eska,1721294659,,
40993744,,I actually learned something about cats from her page. Thanks!,thepancake,1721292762,,
40995047,,This is the way.,j45,1721306543,,
40993697,,"Heck yeah this is exactly how I started when I was 6. HTML books at the library and websites exactly like this.<p>Love this OP, thank you for sharing.",junon,1721292321,,
40994329,,"wow, Congrats her to dev community.",hassanr99,1721299541,,
40993895,,"it&#x27;s so cute, I love everything about it",royal_ts,1721294546,,
40994366,,"Surprisingly similar to our own web page made ~20 years ago as kids. Repeating and animated background, some theme pages with a few words about some hobby or things we liked, and then shit loads of marquee tags, heh.<p><a href=""https:&#x2F;&#x2F;web.archive.org&#x2F;web&#x2F;20180330033122&#x2F;http:&#x2F;&#x2F;moj24.tripod.com&#x2F;"" rel=""nofollow"">https:&#x2F;&#x2F;web.archive.org&#x2F;web&#x2F;20180330033122&#x2F;http:&#x2F;&#x2F;moj24.trip...</a>",matsemann,1721299955,,
40993623,,"smh, wheres the responsive react frontend and the database and nodejs backend? &#x2F;s :P",voidUpdate,1721291533,,
40994313,,&gt; Sometimes they can sleep up to like 18 or 12 hours a day. That is a lot of sleeping for a cat.<p>Can we just put the author of these pages in charge of the whole Internet please?,nmg,1721299439,,
40993725,,Is it her true name?<p>I&#x27;ve been trying to get mine to use an alias but so far is one per service and loses a bit of magic.,fifteen1506,1721292563,,
40993695,,&lt;3,purple-leafy,1721292293,,
40993590,,Well done.,raleighm,1721291122,,
40995922,,it&#x27;s so refreshing not to get popups and cookie gdpr nice!,domatic1,1721313107,,
40996054,,<i>cmd + option + U</i><p><i>...</i><p><i>satisfied smile</i>,jihadjihad,1721313899,,
40995125,,Cute. I&#x27;d like to see a pony page please.,g105b,1721307253,,
40994169,,Now tell her to deploy it on Kubernetes.,devoutsalsa,1721297881,,
40993561,,"Wow, great stuff. Tell her she did a fantastic job!<p>---<p>By necessity, kids these days don&#x27;t even need to learn what a file is. Videos are &quot;on youtube&quot;. Documents are stored &quot;in ms word&quot;.<p>The median developer even seems to have a very shallow understanding of how a computer actually works. And why would they, if they can just glue some Lambdas together to earn a buck?<p>---<p>Praise those that look a bit deeper and really want to know how a thing works, how you can create something truly original with a tool, instead of simply using it along the happy path.",isoprophlex,1721290692,,
40994585,,"<p><pre><code>  &lt;!-- Cloudflare Pages Analytics --&gt;&lt;script defer src=&#x27;https:&#x2F;&#x2F;static.cloudflareinsights.com&#x2F;beacon.min.js&#x27; data-cf-beacon=&#x27;{&quot;token&quot;: &quot;cf82897298e84b9eb36d9490803c2538&quot;}&#x27;&gt;&lt;&#x2F;script&gt;
</code></pre>
Ah, kids these days!",Lockal,1721302150,,
40998029,,[dead],vtempest,1721324637,,
