uid,title,the content,writer,Published at,score,comments_quantity40994700,,"Prolog itself is still developed and used in various settings (mostly swi-prolog?), but other languages and logic engines solve domain specific but similar problems better (rule engines, formal proof verifiers, etc). For exploratory work it can be useful.<p>I have tried to use it in combination will LLMs unsuccessfully, partly because the domain was not specific enough. Otherwise you need a lot of real world knowledge and a large fact database.<p>Logic engines for first order logic in RDF&#x2F;OWL also have interesting logical inference abilities, like graphdbs.<p>Any programming language can do &quot;logic&quot; and the work at MIT&#x2F;CSAIL in probabilistic programming may turn out to be a better way to combine fuzzy logic and formal proofs.<p>Not sure this answers your question, but maybe this points towards some interesting directions.",hendler,1721303279,,
40997351,,My honest opinion is to avoid Prolog for most enterprise needs in favor of a regular general purpose programming language that calls out to a mathematical or constraint solver via API when the need arises. This way you get a language that is easier to learn with a strong ecosystem of libraries along with a solver that is built for your particular problem.<p>Prolog may excel in some niche cases that are documented out there which is fine. For the majority of cases I can think of...it is too esoteric.<p>Prolog is SUPER cool though as is it&#x27;s history. You should definitely play with it a bit.,7thaccount,1721320728,,
40994955,,"Shameless plug: you should check out my podcast The Search Space for a view of the broader landscape of Prolog and logic programming: <a href=""https:&#x2F;&#x2F;thesearch.space&#x2F;"" rel=""nofollow"">https:&#x2F;&#x2F;thesearch.space&#x2F;</a><p>I don&#x27;t publish episodes often but I have a lot of good interviewees lined up :)<p>In general, I would advice you to look beyond Prolog and explore Answer Set Programming, the Picat language, and the connections between logic programming and databases (SQL, RDF or otherwise). Not instead of Prolog, but in parallel. Prolog is awesome!",felixyz,1721305659,,
40996133,,"Girard has some commentary scattered about his writing.<p>The search algorithms for logic programming are simply slow, it&#x27;s a very interesting idea in programming languages, but there&#x27;s a reason it&#x27;s not widely used.<p>&gt; PROLOG, its misery. Logic programming was bound to failure, not be- cause of a want of quality, but because of its exaggerations. Indeed, the slogan was something like « pose the question, PROLOG will do the rest ». This paradigm of declarative programming, based on a « generic » algorithmics, is a sort of all-terrain vehicle, capable of doing everything and therefore doing everything badly. It would have been more reasonable to confine PROLOG to tasks for which it is well-adapted, e.g., the maintenance of data bases.<p>&gt; On the contrary, attempts were made to improve its efficiency. Thus, as systematic search was too costly, « control » primitives, of the style « don’t try this possibility if... » were introduced. And this slogan « logic + control13 », which forgets that the starting point was the logical soundness of the deduction. What can be said of this control which plays against logic14? One recognises the sectarian attitude that we exposed several times: the logic of the idea kills the idea.<p>&gt; The result is the most inefficient language ever designed; thus, PROLOG is very sensitive to the order in which the clauses (axioms) have been written.",vmchale,1721314392,,
40995214,,"The problem with Prolog is that it&#x27;s based on unification, and small unification engines can be expressed in a few lines in any functional programming language.<p>That narrows down the already small niche where one would choose Prolog by probably a few orders.",sproutini,1721307865,,
40995284,,"Tangent to Prolog, perhaps check Flix, which includes logic programming features [1], and is discussed here from time to time [2].<p>--<p>1: <a href=""https:&#x2F;&#x2F;doc.flix.dev&#x2F;fixpoints.html"" rel=""nofollow"">https:&#x2F;&#x2F;doc.flix.dev&#x2F;fixpoints.html</a><p>2: <a href=""https:&#x2F;&#x2F;news.ycombinator.com&#x2F;item?id=25513397"">https:&#x2F;&#x2F;news.ycombinator.com&#x2F;item?id=25513397</a><p>2: <a href=""https:&#x2F;&#x2F;news.ycombinator.com&#x2F;item?id=31448889"">https:&#x2F;&#x2F;news.ycombinator.com&#x2F;item?id=31448889</a><p>2: <a href=""https:&#x2F;&#x2F;news.ycombinator.com&#x2F;item?id=38419263"">https:&#x2F;&#x2F;news.ycombinator.com&#x2F;item?id=38419263</a>",emmanueloga_,1721308597,,
40995231,,"Though i only know Prolog cursorily it is in my todo list of languages to study. I think it has great value in that it teaches you a different <i>paradigm</i> for programming.<p>You might also want to look at Erlang which is used in the Industry and would be helpful for your future. Joe Armstrong was originally inspired by Prolog and he conceived Erlang as Prolog-Ideas+Functional&#x2F;Procedural+Concurrency+Fault-Tolerance. Hence you might find a lot of commonalities here. Here is a recent HN thread on a comparison - <a href=""https:&#x2F;&#x2F;news.ycombinator.com&#x2F;item?id=40521585"">https:&#x2F;&#x2F;news.ycombinator.com&#x2F;item?id=40521585</a><p>There is also &quot;Erlog&quot; (by Robert Virding, one of the co-creators of Erlang) which is described as, <i>Erlog is a Prolog interpreter implemented in Erlang and integrated with the Erlang runtime system. It is a subset of the Prolog standard. An Erlog shell (REPL) is also included.</i> It also says, <i>If you want to pass data between Erlang and Prolog it is pretty easy to do so. Data types map pretty cleanly between the two languages due to the fact that Erlang evolved from Prolog.</i> - <a href=""https:&#x2F;&#x2F;github.com&#x2F;rvirding&#x2F;erlog"">https:&#x2F;&#x2F;github.com&#x2F;rvirding&#x2F;erlog</a>",rramadass,1721308082,,
40994780,,"There are certain (academic) problems for which Prolog is simply the best tool for the job, see e.g., <a href=""https:&#x2F;&#x2F;github.com&#x2F;hbrouwer&#x2F;dfs-tools"">https:&#x2F;&#x2F;github.com&#x2F;hbrouwer&#x2F;dfs-tools</a>",mtsfz2,1721303953,,
40994909,,"I&#x27;ve actually been thinking about this quite a bit. I remember a foray into prolog when I was a younger pup in 2004-6. With the Advent of llms, I think that perhaps we could use llms to extract triples from large corpuses of text and then use that to build our prolog stores or ontologies and work on them. I haven&#x27;t really experimented much with it but you saying this has reminded me that I should dig that back up again.",aldousd666,1721305281,,
40995222,,"Eclipse CLP still seems slightly active: <a href=""https:&#x2F;&#x2F;eclipseclp.org&#x2F;"" rel=""nofollow"">https:&#x2F;&#x2F;eclipseclp.org&#x2F;</a>. I used it for some process scheduling research in the early 2000s but I&#x27;ve never had the chance to apply it in the non-academic world",zelos,1721307962,,
40995996,,"If you are interested in small fun stuff, SWI-Prolog has network libraries. Just recently, I implemented a network gomoku (5-in-a-row) game in it for my school project: <a href=""https:&#x2F;&#x2F;gitlab.mff.cuni.cz&#x2F;volfmat1&#x2F;prolog-network-gomoku"" rel=""nofollow"">https:&#x2F;&#x2F;gitlab.mff.cuni.cz&#x2F;volfmat1&#x2F;prolog-network-gomoku</a>. Turns out you can also write quite imperative-style code with it :D",mvolfik,1721313570,,
40995030,,"The CLP (constraint logic programming) systems available in some Prologs take it to the next level: <a href=""https:&#x2F;&#x2F;us.swi-prolog.org&#x2F;pldoc&#x2F;man?section=clp"" rel=""nofollow"">https:&#x2F;&#x2F;us.swi-prolog.org&#x2F;pldoc&#x2F;man?section=clp</a>",colanderman,1721306380,,
40994617,,"Not quite what you asked for, but as someone using it quite a lot back in the late &#x27;80s during a CS&amp;AI degree, Prolog has its interesting features and I&#x27;m glad I used it, but I haven&#x27;t missed it since.  I do like declarative stuff, eg CSS!, and that remains a good memory.",DamonHD,1721302445,,
40996641,,"I think of Prolog as a general purpose logic programming language and Datalog to be logic programming more focused on data analysis. Data analysis is a very large area, so boundary might get blurry at times.<p>If your data is in a relational database consider Logica - a Datalog family language that compiles to SQL and runs naturally on SQLite, Postgres, DuckDB and Google BigQuery.<p>Easy to install, easy to play with in CoLab or any other Jupyter notebook.<p>Works for data analysis (aggregation, filtering etc) that is commonly associated with SQL, as well as recursive logical querries commonly associalted with Logic programming per-se.<p>Here is what it looks like for a data-analysis-ish query of finding popular baby names over time:<p># Count babies per year.<p>NameCountByYear(name:, year:) += number :-
  BabyNames(name:, year:, number:);<p># For each year pick the most popular.<p>TopNameByYear(year) ArgMax= name -&gt; NameCountByYear(name:, year:);<p># Accumulate most popular name into a table, dropping the year.<p>PopularName(name: TopNameByYear());<p>The classic grand-parent rule looks as usual:<p>Grandparent(a, c) :- Parent(a, b), Parent(b, c);<p>Here is a recursive program for finidng distances in a directed graph:<p>D(a, b) Min= 1 :- Edge(a, b);<p>D(a, b) Min= D(a, x) + D(x, b);<p>Links to CoLabs:<p>Grandparent, ancestor: 
<a href=""https:&#x2F;&#x2F;colab.research.google.com&#x2F;drive&#x2F;1lujnnUOXsF6VrC9__jVB38DLNpZ3boVq?usp=sharing"" rel=""nofollow"">https:&#x2F;&#x2F;colab.research.google.com&#x2F;drive&#x2F;1lujnnUOXsF6VrC9__jV...</a><p>Distance in graph:<p><a href=""https:&#x2F;&#x2F;colab.research.google.com&#x2F;drive&#x2F;1sOCODHqN0ruxZSx_L-V6e9tJsIJE2sQj?usp=sharing"" rel=""nofollow"">https:&#x2F;&#x2F;colab.research.google.com&#x2F;drive&#x2F;1sOCODHqN0ruxZSx_L-V...</a><p>Github repo:
<a href=""https:&#x2F;&#x2F;github.com&#x2F;EvgSkv&#x2F;logica"">https:&#x2F;&#x2F;github.com&#x2F;EvgSkv&#x2F;logica</a>",evgskv,1721317036,,
40994753,,"No idea, but it might be worth looking into Mercury and {mini,micro}Kanren&#x2F;core.logic as more practical iterations on it (either by adding things to Prolog or extracting the interesting to stuff to use in more general purpose languages).",a-french-anon,1721303689,,
40994723,,"There is still academic work on Prolog, and more broadly deductive &#x2F; logic programming. If you are looking at things with a more industrial bent, I would look to Datalog which trades generality in Prolog for performance and predictability. Alternatively, you can go the other way and look at lambdaProlog which adds real abstractions &#x2F; HOFs to Prolog.<p>What I&#x27;ve seen in practice is that while Prolog may be good at <i>describing</i> a solution, its performance is often too lackluster and brittle for actual deployment: it probably fits more as a prototyping language before you do a classic implementation of the solution in a more traditional language.",xavxav,1721303456,,
40996988,,"Not exactly a prolog, but Verse, a logical (and functional, or functional logic) programming language developed at Epic Games by Simon Peyton Jones of Haskell fame and Tim Sweeney. You can already use it to build mods for fortnite or something like that not really sure. But there&#x27;s no open source compiler available yet.",conjurernix,1721318512,,
40995009,,"I would say in the open source world, SWI Prolog is still the king implementation, in regards to tooling, language features beyond ISO Prolog, and toolchains.<p><a href=""https:&#x2F;&#x2F;www.swi-prolog.org&#x2F;"" rel=""nofollow"">https:&#x2F;&#x2F;www.swi-prolog.org&#x2F;</a>",pjmlp,1721306178,,
40995215,,"It&#x27;s a powerhouse, an even bigger secret than Lisp at beating the average.",segmondy,1721307866,,
40995604,,"Don&#x27;t forget the Datalog subset!<p>In the 2000s I was interested in inference over RDF and wanted something a bit more than RDFS and OWL and found out about Datalog:<p><a href=""https:&#x2F;&#x2F;en.wikipedia.org&#x2F;wiki&#x2F;Datalog"" rel=""nofollow"">https:&#x2F;&#x2F;en.wikipedia.org&#x2F;wiki&#x2F;Datalog</a><p>There wasn&#x27;t a lot of literature on it or implementations then but a few years later people realized it&#x27;s a great query language for complex queries that does a great job on transitive closures,  can do math (unlike OWL which won&#x27;t do it because Gödel proved first order logic + math is a hot mess)<p>I took a comparative programming languages course circa 1993,  the instructor thought that that Prolog was a taste of the future of programming.  At first I thought the way you can implement ordinary procedural code in Prolog was really clever but if you write very much of it I think it is awkward;  for instance it is common to treat procedural success as a logical failure because that gets the behavior you want.<p>It&#x27;s counterintuitive that you could write a reasonably fast interpreter for Prolog but Warren figured out how to do it and it really is a neat trick.  In the 1980s the Japanese Fifth Generation project dreamed about parallel Prolog on a machine with 100s of CPUs but it was discovered pretty quickly that you couldn&#x27;t really parallelize Prolog execution so they came up with the less expressive language<p><a href=""https:&#x2F;&#x2F;en.wikipedia.org&#x2F;wiki&#x2F;KL1"" rel=""nofollow"">https:&#x2F;&#x2F;en.wikipedia.org&#x2F;wiki&#x2F;KL1</a><p>I am amused to see papers today where people are working on tasks similar to what they worked on in that project,  parallelizing them with commodity hardware, and get scaling curves that look very similar to what was done with KL1.  (In the end the 5GP settled on the same message-passing architecture that everybody else did until the GPU revolution came)<p>One of the nicest examples in Prolog is writing a parser by just writing the productions which works because Prolog&#x27;s resolver is quite similar to a common parsing algorithm.  In the large however, you can add a library to a normal programming language like Python or Java where you write the same grammar in a DSL and it is handled by the library.<p>See also production rules systems which use &quot;forward chaining&quot; with the RETE algorithm and variants for an approach which looks like Prolog in some ways but works in the reverse direction.  My favorite example of this now is<p><a href=""http:&#x2F;&#x2F;www.clara-rules.org&#x2F;"" rel=""nofollow"">http:&#x2F;&#x2F;www.clara-rules.org&#x2F;</a><p>I built a prototype of a stream processing engine where the control plane was implemented as a set of production rules that would build a processing pipeline of reactive operators,  key-value and triple stores and then tear it down.  Unlike another stream processing engine I worked on, mine always got the right answers.  I think a production rule system could be the target of a &quot;low code&quot; system.  I&#x27;m a little disappointed that I&#x27;ve never seen a Javascript framework that uses production rules because they are a great answer to asynchronous communication choreography.  (See complex event processing)",PaulHoule,1721310789,,
40994994,,My professor swapped Prolog out for Rust at the last minute. I don&#x27;t know whether he did us a disservice or a favor.,shrimp_emoji,1721306068,,
40996203,,With ChatGPT it is a great time to learn new programming languages.<p>Questions such as &quot;give me table with a glossary of basic Prolog terminology  with examples&quot; as well as others can be helpful.,29athrowaway,1721314803,,
40995725,,"I chose to use prolog to essentially build an expert system across and heterogeneous data ecosystem.<p>Prolog could certainly use some serious improvements to its tooling. But the language is simple enough that it doesn&#x27;t prove too much of an issue. You can get some much out of language it can be very powerful. In the system we&#x27;ve built it makes up a purely logical core that is completely referentially transparent, we leave all the ecky side effecting to a host program.",Guthur,1721311749,,
40995274,,"You might be interested in reading about the Japanese &quot;Fifth Generation Computer Systems&quot; project from 1982, which revolved around PROLOG.<p><a href=""https:&#x2F;&#x2F;en.wikipedia.org&#x2F;wiki&#x2F;Fifth_Generation_Computer_Systems"" rel=""nofollow"">https:&#x2F;&#x2F;en.wikipedia.org&#x2F;wiki&#x2F;Fifth_Generation_Computer_Syst...</a><p>&gt;The Fifth Generation Computer Systems (FGCS; Japanese: 第五世代コンピュータ, romanized: daigosedai konpyūta) was a 10-year initiative begun in 1982 by Japan&#x27;s Ministry of International Trade and Industry (MITI) to create computers using massively parallel computing and logic programming. It aimed to create an &quot;epoch-making computer&quot; with supercomputer-like performance and to provide a platform for future developments in artificial intelligence. FGCS was ahead of its time, and its excessive ambitions led to commercial failure. However, on a theoretical level, the project spurred the development of concurrent logic programming.<p>&gt;The term &quot;fifth generation&quot; was intended to convey the system as being advanced. In the history of computing hardware, there were four &quot;generations&quot; of computers. Computers using vacuum tubes were called the first generation; transistors and diodes, the second; integrated circuits, the third; and those using microprocessors, the fourth. Whereas previous computer generations had focused on increasing the number of logic elements in a single CPU, the fifth generation, it was widely believed at the time, would instead turn to massive numbers of CPUs to gain performance.<p>[...]<p>&gt;Concurrent logic programming<p>&gt;In 1982, during a visit to the ICOT, Ehud Shapiro invented Concurrent Prolog, a novel programming language that integrated logic programming and concurrent programming. Concurrent Prolog is a process oriented language, which embodies dataflow synchronization and guarded-command indeterminacy as its basic control mechanisms. Shapiro described the language in a Report marked as ICOT Technical Report 003,[7] which presented a Concurrent Prolog interpreter written in Prolog. Shapiro&#x27;s work on Concurrent Prolog inspired a change in the direction of the FGCS from focusing on parallel implementation of Prolog to the focus on concurrent logic programming as the software foundation for the project.[3] It also inspired the concurrent logic programming language Guarded Horn Clauses (GHC) by Ueda, which was the basis of KL1, the programming language that was finally designed and implemented by the FGCS project as its core programming language.<p>&gt;The FGCS project and its findings contributed greatly to the development of the concurrent logic programming field. The project produced a new generation of promising Japanese researchers.<p><a href=""https:&#x2F;&#x2F;www.sjsu.edu&#x2F;faculty&#x2F;watkins&#x2F;5thgen.htm"" rel=""nofollow"">https:&#x2F;&#x2F;www.sjsu.edu&#x2F;faculty&#x2F;watkins&#x2F;5thgen.htm</a><p>&gt;The Japanese Fifth Generation project was a collaborative effort of the Japanese computer industry coordinated by the Japanese Government that intended not only to update the hardware technology of computers but alleviate the problems of programming by creating AI operating systems that would ferret out what the user wanted and then do it. The Project chose to use PROLOG as the computer language for the AI programming instead of the LISP-based programming of the American AI researchers.<p>The Japanese National Fifth Generation Project: Introduction, survey, and evaluation:<p><a href=""https:&#x2F;&#x2F;stacks.stanford.edu&#x2F;file&#x2F;druid:kv359wz9060&#x2F;kv359wz9060.pdf"" rel=""nofollow"">https:&#x2F;&#x2F;stacks.stanford.edu&#x2F;file&#x2F;druid:kv359wz9060&#x2F;kv359wz90...</a><p>&gt;Abstract:<p>Projecting a great vision of intelligent systems in the service of the economy and society, the Japanese government in 1982 launched the national Fifth Generation Computer Systems (FGCS) project. The project was carried out by a central research institute, ICOT, with personnel from its member-owners, the Japanese computer manufacturers (JCMs) and other electronics industry firms. The project was planned for ten years, but continues through year eleven and beyond. ICOT chose to focus its efforts on language issues and programming methods for logic programming, supported by special hardware. Sequential &#x27;inference machines&#x27; (PSI) and parallel &#x27;inference machines&#x27; (PIM) were built. Performances of the hardware-software hybrid was measured in the range planned (150 million logical inferences per second). An excellent system for logic programming on parallel machines was constructed (XLI). However, applicationswere done in demonstration form only (not deployed). The lack of a stream of applications that computer customers found effective and the sole use of a language outside the mainstream, Prolog, led to disenchantment among the JCMs.<p>Japan&#x27;s Fifth Generation Computer Systems: Success or Failure?<p><a href=""https:&#x2F;&#x2F;www.reddit.com&#x2F;r&#x2F;prolog&#x2F;comments&#x2F;owb0xg&#x2F;japans_fifth_generation_computer_systems_success&#x2F;"" rel=""nofollow"">https:&#x2F;&#x2F;www.reddit.com&#x2F;r&#x2F;prolog&#x2F;comments&#x2F;owb0xg&#x2F;japans_fifth...</a><p><a href=""https:&#x2F;&#x2F;instadeq.com&#x2F;blog&#x2F;posts&#x2F;japans-fifth-generation-computer-systems-success-or-failure&#x2F;"" rel=""nofollow"">https:&#x2F;&#x2F;instadeq.com&#x2F;blog&#x2F;posts&#x2F;japans-fifth-generation-comp...</a><p>&gt;This post is a summary of content from papers covering the topic, it&#x27;s mostly quotes from the papers from 1983, 1993 and 1997 with some edition, references to the present and future depend on the paper but should be easy to deduce. See the Sources section at the end.<p>[...]<p>&gt;Prolog vs LISP<p>&gt;Achieving such revolutionary goals would seem to require revolutionary techniques. Conventional programming languages, particularly those common in the late 1970s and early 1980s offered little leverage.<p>&gt;The requirements clearly suggested the use of a rich, symbolic programming language capable of supporting a broad spectrum of programming styles.<p>&gt;Two candidates existed: LISP which was the mainstream language of the US Artificial Intelligence community and Prolog which had a dedicated following in Europe.<p>&gt;LISP had been used extensively as a systems programming language and had a tradition of carrying with it a featureful programming environment; it also had already become a large and somewhat messy system. Prolog, in contrast, was small and clean, but lacked any experience as an implementation language for operating systems or programming environments. [...]<p>&gt;Fun Trivia<p>&gt;The one commercial use we saw of the PSI machines was at Japan Air Lines, where the PSI-II machines were employed; ironically, they were remicrocoded as Lisp Machines.",DonHopkins,1721308528,,
40994888,,"false.<p><a href=""https:&#x2F;&#x2F;www.j-paine.org&#x2F;dobbs&#x2F;prolog_lightbulb.html"" rel=""nofollow"">https:&#x2F;&#x2F;www.j-paine.org&#x2F;dobbs&#x2F;prolog_lightbulb.html</a>",DonHopkins,1721305038,,
40994839,,[dead],katelyn2598,1721304513,,
40995243,,"&lt;3<p>it&#x27;s good to see a little person having fun with all this technocrap that us grognards have gotten so bitter about over the years&#x2F;decades. :) i hope she continues to have a blast!<p>(from the dedication page in SICP:)<p>“I think that it’s extraordinarily important that we in computer science keep fun in computing. When it started out, it was an awful lot of fun. Of course, the paying customers got shafted every now and then, and after a while we began to take their complaints seriously. We began to feel as if we really were responsible for the successful, error-free perfect use of these machines. I don’t think we are. I think we’re responsible for stretching them, setting them off in new directions, and keeping fun in the house. I hope the field of computer science never loses its sense of fun. Above all, I hope we don’t become missionaries. Don’t feel as if you’re Bible salesmen. The world has too many of those already. What you know about computing other people will learn. Don’t feel as if the key to successful computing is only in your hands. What’s in your hands, I think and hope, is intelligence: the ability to see the machine as more than when you were first led up to it, that you can make it more.”
~Alan J. Perlis (April 1, 1922 – February 7, 1990)",volkadav,1721308186,,
40996801,,"Now this is the real internet. Real people writing about things they&#x27;re interested in, and not with the intention of turning it into a content farm. Of course at 7 years old we cannot expect a deep, fleshed out site like in the Geocities golden age, but I wish older kids and adults would continue this practice of authoring their own pages, and manually linking them together.  CMSes are incredibly limiting by design, every template forces you into the default of &quot;blog post writing mode&quot; when HTML offers so much more flexibility.",rchaud,1721317622,,
40998076,,"&gt; computers are a very important form of technology. Without it no websites, no Roblox studio, and no nothin.<p>Well put, Naya!",appel,1721324908,,
40993693,,"<p><pre><code>    &lt;body background=&quot;animals.jpg&quot;&gt;
        &lt;center&gt;
</code></pre>
Exactly as I would do it if I were a 7yo. Speak what you will about the virtues of CSS and semantic markup, these things get in the way of having fun. And can be learned later.",nathell,1721292270,,
